{
  "pack_id": "ch10",
  "version": "1.0.0",
  "modules": [
    {
      "id": "ch10-m01",
      "title": "Exploring the cloud: definition + characteristics",
      "tag_ids": [
        "cloud_nist_definition",
        "cloud_essential_characteristics",
        "resource_pooling_multitenancy",
        "ondemand_selfservice",
        "broad_network_access",
        "measured_service",
        "rapid_elasticity",
        "elasticity_vs_scalability",
        "scalability_vertical",
        "scalability_horizontal",
        "cloud_benefits_agility"
      ],
      "pages": [
        {
          "id": "ch10-m01-p01",
          "title": "What “cloud” really means",
          "content_blocks": [
            {
              "type": "explain",
              "text": "Cloud computing is a way to rent computing over a network instead of owning it. A provider runs the datacenters and you consume compute, storage, and networking on demand."
            },
            {
              "type": "explain",
              "text": "A key idea is *resource pooling*: many customers share a large pool of hardware. That shared-customer model is called *multitenancy*. Good cloud design isolates tenants so one customer can’t see another’s data."
            }
          ],
          "checks": [
            {
              "type": "single_choice",
              "prompt": "Which statement best captures the core idea of cloud computing?",
              "options": [
                "Renting computing resources over a network from a provider",
                "Buying servers and placing them in a provider’s building",
                "Using only thin clients instead of PCs",
                "Running everything on a single mainframe"
              ],
              "correct_index": 0,
              "explanation": "Cloud computing is primarily about on‑demand consumption of provider-hosted resources over a network.",
              "objectiveIds": [
                "1.1",
                "1.5",
                "1.6",
                "2.2",
                "3.2",
                "3.3",
                "3.4",
                "4.1",
                "4.4",
                "4.6",
                "5.3"
              ]
            },
            {
              "type": "single_choice",
              "prompt": "In a multitenant cloud, what is being shared?",
              "options": [
                "A pool of physical infrastructure used by multiple customers",
                "Only the operating system installed on your VM",
                "Your encryption keys with other organizations",
                "Your administrative accounts with other customers"
              ],
              "correct_index": 0,
              "explanation": "Multitenancy means multiple customers run workloads on shared underlying hardware with isolation between them.",
              "objectiveIds": [
                "1.1",
                "1.5",
                "1.6",
                "2.2",
                "3.2",
                "3.3",
                "3.4",
                "4.1",
                "4.4",
                "4.6",
                "5.3"
              ]
            }
          ],
          "objectiveIds": [
            "1.1",
            "1.5",
            "1.6",
            "2.2",
            "3.2",
            "3.3",
            "3.4",
            "4.1",
            "4.4",
            "4.6",
            "5.3"
          ]
        },
        {
          "id": "ch10-m01-p02",
          "title": "Essential characteristics (the exam loves these)",
          "content_blocks": [
            {
              "type": "explain",
              "text": "Cloud services are designed to be: on‑demand (self‑service), reachable over the network, and measured (you’re billed by usage)."
            },
            {
              "type": "explain",
              "text": "Two closely related terms: *scalability* is the ability to grow capacity; *elasticity* is scaling up and down automatically to match demand and cost."
            },
            {
              "type": "explain",
              "text": "Scaling can be vertical (bigger server) or horizontal (more servers). Horizontal scaling is often the cloud’s superpower."
            }
          ],
          "checks": [
            {
              "type": "single_choice",
              "prompt": "What’s the best one-line difference between scalability and elasticity?",
              "options": [
                "Scalability grows capacity; elasticity grows and shrinks capacity as demand changes",
                "Scalability is only horizontal; elasticity is only vertical",
                "Elasticity is manual; scalability is automatic",
                "They are identical terms on the exam"
              ],
              "correct_index": 0,
              "explanation": "Scalability focuses on growth; elasticity adds the idea of contraction when demand drops.",
              "objectiveIds": [
                "1.1",
                "1.5",
                "1.6",
                "2.2",
                "3.2",
                "3.3",
                "3.4",
                "4.1",
                "4.4",
                "4.6",
                "5.3"
              ]
            },
            {
              "type": "single_choice",
              "prompt": "Horizontal scaling usually means…",
              "options": [
                "Adding more servers/instances to share the load",
                "Adding more RAM to an existing server",
                "Switching to a faster CPU in the same machine",
                "Replacing on-prem hardware with SaaS"
              ],
              "correct_index": 0,
              "explanation": "Horizontal scaling increases capacity by adding instances, not upgrading a single machine.",
              "objectiveIds": [
                "1.1",
                "1.5",
                "1.6",
                "2.2",
                "3.2",
                "3.3",
                "3.4",
                "4.1",
                "4.4",
                "4.6",
                "5.3"
              ]
            }
          ],
          "objectiveIds": [
            "1.1",
            "1.5",
            "1.6",
            "2.2",
            "3.2",
            "3.3",
            "3.4",
            "4.1",
            "4.4",
            "4.6",
            "5.3"
          ]
        }
      ],
      "objectiveIds": [
        "1.1",
        "1.5",
        "1.6",
        "2.2",
        "3.2",
        "3.3",
        "3.4",
        "4.1",
        "4.4",
        "4.6",
        "5.3"
      ]
    },
    {
      "id": "ch10-m02",
      "title": "Cloud roles and service models (XaaS)",
      "tag_ids": [
        "cloud_roles_csp",
        "cloud_roles_consumer",
        "cloud_roles_broker",
        "cloud_roles_auditor",
        "cloud_roles_carrier",
        "service_model_iaas",
        "service_model_paas",
        "service_model_saas",
        "service_model_faas_serverless"
      ],
      "pages": [
        {
          "id": "ch10-m02-p01",
          "title": "Cloud roles: who does what",
          "content_blocks": [
            {
              "type": "explain",
              "text": "Cloud environments involve multiple roles. The *cloud service provider (CSP)* runs the infrastructure and delivers services."
            },
            {
              "type": "explain",
              "text": "The *consumer* uses those services. A *broker* helps consumers pick/manage services. A *carrier* provides the network path. An *auditor* independently evaluates security and compliance."
            }
          ],
          "checks": [
            {
              "type": "single_choice",
              "prompt": "Which cloud role is responsible for delivering the cloud service?",
              "options": [
                "Cloud service provider",
                "Cloud consumer",
                "Cloud auditor",
                "Cloud carrier"
              ],
              "correct_index": 0,
              "explanation": "The provider operates the datacenters and delivers the service.",
              "objectiveIds": [
                "1.1",
                "1.5",
                "1.6",
                "2.2",
                "3.2",
                "3.3",
                "3.4",
                "4.1",
                "4.4",
                "4.6",
                "5.3"
              ]
            },
            {
              "type": "single_choice",
              "prompt": "Which role independently assesses security or compliance?",
              "options": [
                "Cloud auditor",
                "Cloud broker",
                "Cloud carrier",
                "Cloud consumer"
              ],
              "correct_index": 0,
              "explanation": "Auditors perform independent evaluation/assurance.",
              "objectiveIds": [
                "1.1",
                "1.5",
                "1.6",
                "2.2",
                "3.2",
                "3.3",
                "3.4",
                "4.1",
                "4.4",
                "4.6",
                "5.3"
              ]
            }
          ],
          "objectiveIds": [
            "1.1",
            "1.5",
            "1.6",
            "2.2",
            "3.2",
            "3.3",
            "3.4",
            "4.1",
            "4.4",
            "4.6",
            "5.3"
          ]
        },
        {
          "id": "ch10-m02-p02",
          "title": "Service models: IaaS vs PaaS vs SaaS vs FaaS",
          "content_blocks": [
            {
              "type": "explain",
              "text": "Service models describe *how much the provider manages* for you."
            },
            {
              "type": "explain",
              "text": "*IaaS*: you rent virtual servers, storage, and networking. You secure the OS and anything above it."
            },
            {
              "type": "explain",